{
  "schemaVersion": 1,
  "ticketIdPattern": "^\\d+$",
  "plans": {
    "repositoryFolder": "alignfirst",
    "autoArchive": true
  },
  "git": {
    "defaultBranch": "main",
    "branchNameTemplate": "{TICKET_ID}/{slug-1-3-words}",
    "commit": {
      "style": "conventionalCommit"
    },
    "agentCoauthoring": false
  }
}
